{
  "model": "claude-opus-5",
  "repository_fingerprint_sha256": "bf5e422e504f8e564b241d7006129481db8821ea70f585b1dd6b9c563ffda2ee",
  "audit_summary": "Independent fifth-audit pass over the Trust Kernel Closure at f8c2b2c (branch fix/legacy-renewal-v1-trust-kernel-closure, base 0a5cee7, 21 commits — all three brief-declared values independently verified through the shared object database; the audited worktree is detached-HEAD at the same commit). Baseline integrity, coverage integrity, package/distribution content and the CI/publish workflows were checked; all mandatory local gates were re-run fresh at final HEAD after a frozen-lockfile install: build 0, lint 0, test 0 (172 files / 2437 tests, 0 skipped), test:coverage 0 (statements 92.99, branches 89, functions 96.29, lines 92.99 against thresholds 91/89/96/91, unchanged in the 21 commits, no istanbul/c8/v8 ignore directives anywhere in production source, only legitimate root/availability conditional skips), packed-install smoke PASS (pack, install, lco init, --help/--version, doctor, lco-mcp JSON-RPC handshake, offline browser clarification workspace, renew offline surface). Each of the six closure contracts was reconstructed from source rather than from the remediation reports, then attacked with fresh probes that are not replays of remediation-authored tests. Contracts 2 (ContextBundle/Evidence Identity), 3 (Immutable ResolvedPaidOperation), 4 (Structural Artifact Coherence), 5 (Zero Unmediated Trust Consumers) and 6 (Canonical Ownership and Dependency Direction) held under every falsification attempt I could construct: T3-1 containment and all range escapes refused; foreign, spliced, re-identified and post-seal-edited context record sets refused by bundle-digest recomputation; ordering, multiplicity, project, snapshot and structural epoch all participate in bundle identity; redaction verified text-idempotent over an adversarial marker-shaped corpus, so the sealed slice hash equals the bytes the prompt actually renders; post-resolution mutation of every caller-owned route object (nested extraBody arrays, provider routing, budget) left the serialized wire request and the consent digest unchanged, the wire byte cap refused before transport with zero calls, and the ledger is constructor-owned with no API to supply an external one; mixed A/B manifest/graph pairs, binding replay, hand-edited bindings, unrecorded graph sources, empty and missing manifests, and same-source-set-different-semantics all refused; trust/* has zero upward imports into cli/mcp/browser-client/server and trust/state.ts is in no import cycle under an independently written Tarjan analysis of all 146 production modules; the six canonical digest domains are mutually distinct and version-separated. ONE release-blocking defect was found, in Contract 1 (Transaction Atomicity and Recovery), and it is a defect in recovery rather than in commit: recoverTxJournal never compares the journal's base_revision against the current on-disk revision, so a journal that survives a crash in the window between the (successful, durable) revision write and its own unlink is reverse-applied by the next trusted read. A fully committed revision R+1 is then silently rolled back to R, its stores reverted to pre-commit bytes, readRevision returns success, and loadActiveState renders the result as healthy. I reproduced this end-to-end against the real kernel using the kernel's own journal, with a committed human strategy decision as the payload: strategy.json was written and the revision advanced to 2, and after the next read the revision was 1, strategy.json was gone, and the store reported store_missing — ordinary 'not yet decided' state rather than any error. This is silent loss of committed trusted state and human authority reachable by an ordinary process death, and it is the precise fault-matrix cell ('before journal cleanup') the audit brief enumerates. The same missing check makes any older journal reintroduced onto disk a replayable rollback authority. Five further non-blocking findings are recorded: a silent drop of operator-configured route headers on renewal paid routes, a text-insensitive dedup key in sealContextBundle that is unreachable from the production caller, two canonical-ownership claim inaccuracies (raw createHash for trust-bearing structural digests, and one digest domain+version reused across two different payload schemas), and an import-cycle observation outside the trust ownership domain. No evidence contradicted the remediation's consumer-bypass closure: the former eight bypass classes are closed in current source, every renewal filesystem write and paid transport construction routes through the kernel, and I found zero unmediated trust-bearing consumers.",
  "findings": [
    {
      "id": "OPUS-001",
      "origin": "OPUS-001",
      "title": "Post-commit journal recovery silently rolls back a fully committed revision and its stores",
      "category": "transaction-atomicity-recovery",
      "severity": "HIGH",
      "confidence": "HIGH",
      "status": "PROVISIONAL",
      "claim": "recoverTxJournal treats the mere presence of a transaction journal as proof that its committer died MID-commit, and never verifies that the journal's base_revision still matches the current on-disk revision. A journal also survives a crash AFTER a fully successful commit, in the window between the durable revision write and removeJournal's unlink. On the next trusted read the kernel integrity-verifies that journal (it is genuine, so it verifies), sees superseded !== true, and reverse-applies it: the committed revision R+1 is rolled back to R and every store in the write set is reverted to its pre-commit bytes. readRevision returns the rolled-back revision with NO error and loadActiveState renders the result as fully healthy, so a trusted reader silently observes the destruction of a completed, durable transaction.",
      "evidence": [
        {
          "kind": "OBSERVED_FACT",
          "path": "packages/spec-core/src/renew/trust/state.ts",
          "symbol": "recoverTxJournal",
          "lines": "864-940",
          "description": "The recovery routine validates schema_version, entries being an array, base_revision being a number, the domainDigest integrity, and the superseded marker — and then calls rollbackJournal unconditionally. There is no comparison of journal.base_revision against readRevisionUnlocked(projectDir). readRevisionUnlocked already exists in the same module and is used for exactly this comparison inside fenceWriterLock, so the check is available but is not applied on the recovery path."
        },
        {
          "kind": "OBSERVED_FACT",
          "path": "packages/spec-core/src/renew/trust/state.ts",
          "symbol": "applyStateMutation",
          "lines": "506-516",
          "description": "The commit's final steps are: fenceWriterLock, persistTrustedJson of the new revision (the transaction's durable commit point), performed += 1, then removeJournal. A process death between the revision write and removeJournal leaves a genuine, integrity-valid, non-superseded journal on disk whose base_revision is now exactly one less than the durable on-disk revision. This is the 'before journal cleanup' cell of the audit brief's own partial-commit fault matrix."
        },
        {
          "kind": "OBSERVED_FACT",
          "command_ref": "node probe4.js — real project via cmdRenewInit; the kernel's own journal is written normally and only its unlink is suppressed (trustFs.authorizedRemoveTree intercepted for the tx-journal.json path) to simulate a crash in exactly that window; then a fresh trusted read is performed",
          "description": "Observed: commit ok, on-disk revision R+1 = 2, journal present. Next trusted read: readRevision returned ok with value 1 (NOT a refusal), on-disk revision reverted to 1, stores reverted to pre-commit bytes, journal removed, and loadActiveState returned ok with revision 1 and overlay.ok = true / parity.ok = true — i.e. the state renders as HEALTHY at the superseded revision."
        },
        {
          "kind": "OBSERVED_FACT",
          "command_ref": "node probe5.js section A — the same crash window with a committed human strategy decision as the payload",
          "description": "Observed: the transaction committed strategy.json (rationale 'HUMAN DECISION THAT MUST NOT VANISH') and advanced the revision to 2. After the next trusted read: revision 1, strategy.json ABSENT, and loadActiveState reported strategy store_missing — which renders as ordinary 'no strategy decided yet' state, not as an error. A committed human decision is destroyed silently."
        },
        {
          "kind": "OBSERVED_FACT",
          "command_ref": "node probe2.js / probe3.js section A — a journal whose base_revision is older than the current revision, planted on disk",
          "description": "Independently of any crash, an older journal reintroduced onto disk (backup restore, directory copy, rsync of .lco/) is accepted and reverse-applied by the same code path: revision 1 was rolled back to 0 and the overlay store was reverted to the journal's recorded old bytes, again with readRevision returning success."
        },
        {
          "kind": "REQUIREMENT_CLAIM",
          "requirement_ref": "Audit brief, CONTRACT 1 sections 1B, 1C, 1D, 1F and 1L; Audit Contract acceptance criteria for Contract 1",
          "description": "1C requires the journal's expected revision to be 'sufficient and actually verified'. 1D requires an 'old valid journal replayed after later revision' to produce a typed refusal or deterministic safe recovery. 1F requires the invariant to hold when faulting 'before journal cleanup'. 1L forbids 'silent authority/state loss'. The release verdict rules list 'recovery can accept torn state' among the NO-GO examples."
        }
      ],
      "counter_evidence": [
        {
          "kind": "OBSERVED_FACT",